United States,Police brutality protests,May-20,Free,Excessive use of lethal force by police officers against unarmed Black civilians.,"Ongoing police brutality toward communities of Black people, and broader issues of systemic racism.",">100,000",General public.,Active,Multiple local governments have reduced funding for the police. Some of the officers involved in the deaths of George Floyd and Breonna Taylor have been arrested.,
Uruguay,Farmer protest,Jan-18,Free,Rising taxes for farmers and rising fuel prices.,Lack of government support for farmers and increasing agriculture costs.,">10,000",Farmers’ organizations.,1 day,Then president Tabaré Vázquez met with representatives and announced measures such as reductions for fuel prices and electricity rates.,
Venezuela,“Mother of All Marches” protests,Apr-17,Not free,Attempt by Venezuelan Supreme Court to dissolve the opposition-controlled legislature.,"Growing authoritarianism, economic crisis, and ensuing food and medicine shortages.","200,000",Political opposition.,3 months,No policy/leadership change in response to the protests.,
Venezuela,January 2019 protests,Jan-19,Not free,Opposition leader Juan Guaidó’s self-declared claim to be the president of Venezuela.,"Economic collapse, corruption, food shortages, brutal government repression of dissidents, and political authoritarianism.",">100,000",Working-class citizens who once represented one of the regime’s bastions of support.,Last major protests in March 2020,No policy/leadership change in response to the protests.,
Vietnam,Cybersecurity/special economic zone protests,Jun-18,Not free,"A bill that would allow foreign investors to occupy land in three special economic areas, and a cybersecurity law that would require tech companies to store data of Vietnam-based users in the country.","Fear of growing Chinese influence through special economic zones, concerns over citizens’ privacy and limited freedoms of speech, and the effects of the cybersecurity law on the digital economy’s growth.","50,000",General public.,1 week,The vote on the bill involving special economic zones was delayed until May 2019.,
Zimbabwe,Mugabe protest,Nov-17,Partly free,"Military takeover of power, after which protesters began demanding that then president Robert Mugabe step down.",Desire for political reforms and repression under Mugabe.,">10,000","General public, including war veterans.",1 day,Mugabe stepped down and was replaced by Emmerson Mnangagwa.,