Country,Protest Name,Start Date,Freedom Rating (Status) at Start Date,Triggers,Motivations,Peak Size,Key Participants,Duration,Outcomes,
Albania,Local elections protests,Feb-19,Partly free,Suspicions that Prime Minister Edi Rama engaged in electoral fraud to win the country's 2017 parliamentary elections.,Electoral fraud and corruption.,">10,000",Opposition parties.,5 months,No policy/leadership change in response to the protests.,
Algeria,Protests against “Le Pouvoir”,Feb-19,Not free,Then president Abdelaziz Bouteflika’s decision to seek a fifth term as president.,"Economic downturn, corruption and nepotism, and desire for removal of entrenched military and political elites.",">1,000,000","Opposition parties; a wide range of everyday citizens, such as bankers, truck drivers, teachers, students.",Active,"Bouteflika resigned. Military and political elites retained power in subsequent elections, triggering further unrest.",
Argentina,Austerity protests,Sep-18,Free,Proposal of austerity measures mandated by the International Monetary Fund.,"Rising inflation and unemployment, as well as higher utility costs.",">10,000","Teachers, social organizations, leftist groups.",1 year (sporadic),No policy/leadership change in response to the protests.,
Argentina,Violence against women protests,Apr-20,Free,Increasing rates of violence and femicide against women during the government-mandated lockdown.,Violence against women and lack of resources/institutions to combat it.,Thousands,Women.,1 month,The Supreme Court of Mendoza established several protocols for domestic violence victims to file complaints.,
Armenia,“#RejectSerzh” protests,Apr-18,Partly free,"Election of then president Serzh Sargsyan as prime minister, allowing him to subvert presidential term limits.","Democratic backslide, poverty, and corruption.",">100,000","Students, opposition leaders.",2 weeks,"Sargsyan resigned as prime minister and was succeeded by Nikol Pashinyan, an opposition leader and leading figure in the protests.",
Australia,Wildfire protests,Jan-20,Free,Government response to the Australian bushfires.,Climate change and weak government policies on climate.,"30,000","Students, activists.",2 days,"Prime Minister Scott Morrison admitted some regret over government policies, increased funding to respond to the bushfires, and promised that a royal commission would review the government response.",
Australia,Racial equality protests,Jun-20,Free,"Death of George Floyd in the United States, sparking protests in Australia against local police brutality and racism.","Local issues of racism, institutional racism, and police violence against Aboriginal people.",">10,000",General public.,Active,No policy/leadership change in response to the protests.,
Azerbaijan,Political prisoner protest,Jan-19,Not free,"Opening of a new criminal case against political prisoner and anticorruption blogger Mehman Huseynov, who had run a Facebook page critical of the authorities.","Imprisonment of journalists and civil society members, political prosecutions, police brutality, corruption, and lack of democratic reform.","5,000",Umbrella group of opposition parties.,1 day,Government dropped the new charges against Huseynov.,
Bangladesh,Road safety protests,Jul-18,Partly free,Two students killed by a bus driver.,"Lack of road safety, corruption in transportation sector, arrests or disappearances of opposition activists in recent years, and lack of accountable governance.","15,000","Middle school, high school, university students.",1 week,Installation of legal reforms to raise penalties related to dangerous driving.,
Belarus,“Parasite” tax protests,Feb-17,Not free,Labor law that would require citizens who work less than half the year and fail to register with state labor exchanges to pay $250.,"Economic downturn, poverty, continued political restrictions, and detention of opposition activists.",">1,000",General public.,1 month,President Alexander Lukashenko suspended the tax for a year.,
Belarus,“Slipper uprising”,Jun-20,Not free,Arrests of opposition presidential candidates.,Opposition to President Alexander Lukashenko’s reelection campaign.,Thousands,General public.,Active,No policy/leadership change in response to the protests.,
Benin,Election protests,Mar-19,Free,"Exclusion of five opposition parties from legislative elections, and consequent electoral victory of government-aligned political parties.",Growing authoritarianism and crackdown on political opponents and media.,">1,000",Political supporters of former president Thomas Yayi.,4 months,No policy/leadership change in response to the protests.,
Bolivia,Wildfire protests,Oct-19,Partly free,Then president Evo Morales’s refusal to declare the wildfires in Bolivia a national disaster.,Morales’ environmental policies and growing popular discontent with the president.,"1,500,000",General public.,1 week,No policy/leadership change in response to the protests.,
Bolivia,2019 election protests,Oct-19,Partly free,"Electoral irregularities in the 2019 presidential election, in which then president Evo Morales narrowly avoided a runoff contest in suspicious circumstances. After Morales resigned, his supporters led additional protests, alleging he was the victim of a coup.",Fears over electoral fraud and growing authoritarian tendencies.,">10,000","Opposition parties, labor groups, middle-class citizens, some indigenous groups, and (later) Morales’s supporters.",1 month,Morales resigned and was replaced by an interim government. Elections are scheduled to be held in May 2020.,
Bosnia and Herzegovina,“Justice for David” protests,Mar-18,Partly free,"Suspicious death of a young man named David Dragičević, triggering suspicions that the authorities in the Serb region of Bosnia are obstructing the investigation and protecting his killers.","Impunity, weak rule of law, and corruption.",">10,000",Bosnian Serbs.,9 months,No policy/leadership change in response to the protests.,
Brazil,Education cuts protests,May-19,Free,Cuts in education spending and postgraduate scholarships.,Economic challenges and government attacks on public education.,">100,000","Students, teachers, teachers’ unions.",3 months,No policy/leadership change in response to the protests.,
Brazil,Coronavirus protests,Mar-20,Free,"President Jair Bolsonaro’s poor and slow response to the coronavirus outbreak; and the death of George Floyd in the United States, sparking protests against local police brutality and racism.","Lack of an effective government response to the spread of the coronavirus, racism in Brazil, and police brutality against Black Brazilians.",Thousands,General public.,Active,No policy/leadership change in response to the protests.,
Chile,Subway fare protests,Oct-19,Free,Increased price of metro fares.,"Severe inequality, low wages and pensions, poor service delivery, discontent with government, militarized response to the protests, and government leaders' corruption.",">1,000,000","Students, young people, professionals, civil society groups.",Active,"Subway fare hike was reversed, and legislators agreed to a 2020 referendum over whether to write a new constitution.",
Colombia,National strikes,Nov-19,Partly free,"Rumored pensions cuts, implementation challenges of the country's peace deal, and rising violence.","Disapproval of President Iván Duque Márquez's government, rising economic inequality, corruption, and militarized response to protests.",">1,000,000","Students, unions, leftist groups, and indigenous groups.",4 months,No policy/leadership change in response to the protests.,
Colombia,Coronavirus protests,Mar-20,Partly free,"President Ivan Duque’s undermining of local and regional authorities, citizens’ claims that they were not receiving the aid the government promised, and rising number of deaths among doctors and nurses.",Lack of an effective government response to the spread of the coronavirus.,Hundreds,General public.,Active,No policy/leadership change in response to the protests.,
Colombia,Prison protest,Mar-20,Partly free,"Unsanitary conditions in prisons, which could accelerate the spread of the coronavirus among inmates.","Unsanitary conditions in prisons, including overcrowding and lack of access to water.",Unknown,Prisoners.,1 day,No policy/leadership change in response to the protests.,
Costa Rica,Tax reform protests,Sep-18,Free,Proposed tax reforms and salary cuts for government workers.,Impact of austerity measures on lower- and middle-class workers and growing inequality.,">1,000","Trade unions, public sector workers.",1 month,No policy/leadership change in response to the protests.,
Croatia,Teachers’ strike,Nov-19,Free,Government rejection of teachers’ unions’ salary demands.,Low compensation of education workers.,"20,000","Members of teachers’ unions, teachers, children.",1 month,Government reached a wage agreement with teachers.,
Czech Republic,“Million Moments for Democracy” protests,Apr-19,Free,"Corruption allegations against Prime Minister Andrej Babiš, and his appointment of a close ally as justice minister.","Government corruption, threats to judicial independence, and democratic backslide.","250,000",General public.,8 months,No policy/leadership change in response to the protests.,
Democratic Republic of the Congo,Election delay protests,Dec-17,Not free,Continued attempts by then president Joseph Kabila to stay in power beyond his term limit by delaying elections.,"Lack of transition of power, rising authoritarianism, and violent government response to protests.",">1,000","Religious leaders, civil society organizations.",6 months,"Kabila agreed to step down as president and hold new elections, which were suspected of being rigged. Despite leaving office, Kabila is seen as retaining significant influence in the new government led by President Félix Tshisekedi.",
Dominican Republic,Corruption protests,Jul-17,Partly free,Indictment of leading political officials and businessmen in a bribery scandal.,Bribery of politicians.,">10,000",Young people.,"1 year, 6 months",No policy/leadership change in response to the protests.,
Ecuador,Fuel subsidy protests,Oct-19,Partly free,Proposal of an austerity package that would increase fuel costs and cut salaries for public sector jobs.,Economic inequality and indigenous land rights.,">10,000","Indigenous groups, transportation unions, student groups, labor unions.",2 weeks,Government agreed to cancel austerity package.,
Ecuador,Coronavirus protests,May-20,Partly free,Announcement of the closure of some state-owned companies and cuts to salaries of public sector workers.,Economic impacts of the coronavirus pandemic response.,4000,"Trade unions, social welfare organizations.",1 day,No policy/leadership change in response to the protests.,
Egypt,Corruption protests,Sep-19,Not free,Revelations that President Abdel Fattah el-Sisi and his inner circle used public funds for personal gain.,Corruption and rising levels of poverty despite economic growth.,">1,000",Young people.,1 week,No policy/leadership change in response to the protests.,
Ethiopia,Political prisoner protests,Feb-18,Not free,"Citizens’ demands for the release of senior opposition leader Bekele Gerba from prison, after then prime minister Hailemariam Desalegn had reneged on his promise to release all political prisoners. Prior protests had begun in 2015, led by the Oromo and Amhara ethnic groups over ethnic discrimination.","Demands for increased political freedom, reforms, and ethnic representation in federal structures.",">1,000",Oromo and Amhara ethnic groups.,3 days,"Opposition figures were freed, Desalegn stepped down, and the government declared a state of emergency.",
France,Labor reform protests,Sep-17,Free,Changes to private sector labor laws that would reduce damages for fired workers and favor companies in negotiations with workers.,Perceptions of President Emmanuel Macron's administration as overly favorable to businesses.,"200,000","Trade unions, general public.",2 weeks,No policy/leadership change in response to the protests.,
France,Rail unions’ protests,Mar-18,Free,"Announcement of plans to reduce retirement benefits, reform unemployment insurance, and permit competition to the national rail service.",Threats to public services and public sector employees.,"200,000","Public sector workers, trade unions, students.",2 months,No policy/leadership change in response to the protests.,
France,“Yellow Vest” protests,Nov-18,Free,Proposal of a new fuel tax.,"Economically regressive policies, declining standard of living, growing inequality, and perception of government as overly favorable to the rich.","300,000","Initially mostly rural citizens, then later some urban working- and middle-class participants; some support from and participation by controversial far-right political groups.","1 year, 6 months","The government canceled the fuel tax increase, increased minimum wage and public spending, promised tax cuts, and initiated the Grand Débat to try to rebuild public trust in the government.",
France,Pension reform protests,Dec-19,Free,Government plans for pension reform.,Pension reform.,"800,000","Unions, public sector employees, Yellow Vest protesters, students, lawyers, rail workers.",4 months,"The government scrapped plans to raise the retirement age but maintained its plans to install other pension reforms, such as reducing the pension categories and redistributing benefits toward citizens with lower incomes.",
France,Black Lives Matter protests,Jun-20,Free,"Deaths of George Floyd in 2020 in the United States and Adama Traore in 2016 in France, both at the hands of the police.","Police brutality in France, France’s colonial legacy, and a lack of government recognition or societal discussion of issues of systemic racism.","20,000",General public.,Active,No policy/leadership change in response to the protests.,X
Gambia,“Three Years Is Enough” protests,Dec-19,Partly free,Concerns that President Adama Barrow would renege on his promise to rule for only three years in a provisional government before calling elections and not running.,"Lack of political reforms, democratic backslide, and lack of government transparency.","10,000",General public.,1 month,No policy/leadership change in response to the protests.,
Gaza Strip,“Great March of Return” protests,Mar-18,Not free,"Israeli economic blockade of the Gaza Strip, and Palestinian demand for the right to return to land in what is currently considered Israel.","Economic crisis caused by the blockade (including high unemployment along with electricity and food shortages), and Palestinians’ demand for the right to return.","40,000",Palestinians.,"1 year, 9 months",No policy/leadership change in response to the protests.,
Georgia,Russian interference protests,Jun-19,Partly free,"Russian lawmaker’s entry into the Georgian Parliament, during which he took the speaker’s seat.",Concerns that the ruling party is too friendly to Russia.,"10,000",General public.,1 week,"Then parliament speaker Irakli Kobakhidze resigned, and a proposal was made to change to an electoral system based on proportional representation.",
Georgia,Electoral reform protests,Oct-19,Partly free,Parliament's failure to pass electoral reform that would change the system to proportional representation.,"Democratic backslide, crackdown on political opponents, and discontent with the electoral system that advantages the ruling party.","20,000",General public.,1 week,No policy/leadership change in response to the protests.,
Germany,Far-right pact protests,Feb-20,Free,"Cooperation between the state branches of far-right party Alternative for Germany (AfD) and the center-right Christian Democratic Union and left-leaning Free Democratic Party (FDP) to oust the state premier of Thuringia, Bodo Ramelow, and replace him with Thomas Kemmerich, a member of the FDP. The pact was a visible violation of mainstream political norms that opposed cooperating with far-right parties.",State-level mainstream parties’ cooperation with far-right parties.,"18,000","Unions, antifascist groups, young people.",1 week,"The manner of Ramelow’s dismissal prompted outrage that led to the resignation of the ruling Christian Democratic Union’s chair, Annegret Kramp-Karrenbauer, Chancellor Angela Merkel’s handpicked successor. Kemmerich eventually stepped down from his position as state premier, after which Ramelow reclaimed the post.",
Germany,Coronavirus lockdown protests,Apr-20,Free,Perception that government measures to combat the coronavirus violate citizens’ rights and liberties.,View of government measures as overly restrictive.,Thousands,"Right- and left-wing extremists, conspiracy theorists, antivaccine groups.",1 month,No policy/leadership change in response to the protests.,
Germany,Police brutality protests,Jun-20,Free,"Death of George Floyd in the United States, sparking protests against local police brutality and racism in Germany.","Police brutality, systemic racism, and lack of government recognition of systemic racism.",">100,000",General public.,Active,No policy/leadership change in response to the protests.,
Greece,Pension reform strike,Feb-20,Free,Twenty-four-hour strike in response to proposed pension reform.,"Citizens' fears of pension cuts, which could require them to retire later.","10,000",Public sector trade unions.,1 day,No policy/leadership change in response to the protests.,
Guinea,Term limit protests,Oct-19,Partly free,Suspicions that President Alpha Condé would seek a third term by amending the constitution.,Rising authoritarianism and repression of dissent and protests.,">100,000","Coalition of politicians, activists.",5 months,No policy/leadership change in response to the protests.,
Haiti,PetroCaribe protests,Jul-18,Partly free,"Revocation of fuel subsidies, and revelations of President Jovenel Moïse’s direct involvement in a corruption scandal.","Poverty, corruption, lack of economic development despite economic aid, and inadequate public services and infrastructure.",">10,000","Political opposition, young people, union workers, university professors, business associations, middle-class participants.","1 year, 5 months","In July 2018, the fuel hike was reversed, and then prime minister Jack Guy Lafontant resigned.",
Honduras,2017 election protests,Dec-17,Partly free,"Significant irregularities in the reporting of the results of the December 2017 presidential election, which President Juan Orlando Hernández won narrowly.","Electoral fraud and broader democratic erosion (in other words, subversion of term limits).",">10,000","Political opposition, religious institutions.",2 weeks,No policy/leadership change in response to the protests.,
Honduras,Privatization reform protests,Apr-19,Partly free,"Proposed reforms to the education and healthcare sectors, and revelations that President Juan Orlando Hernández received contributions from drug traffickers.","Government corruption, falling spending on public services, and widespread poverty despite economic growth.",">10,000","Teachers, medical professionals, unions, trade groups, farmers, taxi and truck drivers, police officers.",6 months,Hernández withdrew the proposed legislation.,
Hong Kong,Sentencing protest,Aug-17,Partly free,Sentencing of three leaders of the 2014 Umbrella Movement to six to eight months in prison on the charge of unlawful assembly.,"Restriction of civil liberties, autonomy from China, and questions over judicial independence.","22,000",General public.,1 day,No policy/leadership change in response to the protests.,
Hong Kong,Extradition bill protests,Apr-19,Partly free,Introduction of a bill that would permit extradition of criminal suspects from Hong Kong to China.,"Erosion of Hong Kong’s one country, two systems autonomy from China, and restriction of civil liberties.","2,000,000","General public, especially younger citizens and students.",Active,"The Hong Kong government retracted the extradition bill. It also stepped back from postponing local council elections, which pro-democracy groups won.",
Hungary,“Slave law” protests,Dec-18,Free,"Legislation that would increase the amount of overtime employers could demand from employees, and the creation of a parallel court system.",Democratic backslide under Prime Minister Viktor Orbán and structural economic challenges (such as support for the country’s aging population).,"100,000","Trade unions, civil society groups, opposition parties.",10 months,No policy/leadership change in response to the protests.,
India,Farmer protests,Apr-17,Free,"Challenges facing Indian farmers in different regions, including low crop prices, droughts, and mounting debt owed to banks or money lenders.","Discontent with government policies on farming, lack of government assistance, and stagnating incomes for farmers.","100,000",Farmers’ organizations.,"1 year, 8 months (sporadic)","There were a series of farmer protests in different states; in Maharashtra, the government promised to settle tribal farmers’ disputes over land ownership and to expand the loan-waiver scheme.",
India,Reservations protests,Aug-17,Free,"Demands by the Maratha community, which has been historically reliant on farming, for reserved quotas for government jobs and college admissions.","Rural economic downturn, rising unemployment, and view of reservations as critical for broadening economic opportunity by attaining higher education or securing better jobs.","800,000","Members of the Maratha community, young people, senior citizens.",1 year (sporadic),"In November 2018, Maharashtra’s state legislature passed a bill giving Marathas a 16 percent share of reserved slots for university admissions and government jobs under their status as a socially and economically backward class. After the reservation decision was challenged in the courts, the Bombay High Court ruled in June 2019 that the reservation quota should be lowered to 12 percent for university admissions and 13 percent for government jobs.",
India,SC/ST Act protests,Apr-18,Free,"Recent Supreme Court decision stating that the Scheduled Caste and Scheduled Tribe Act (SC/ST Act), which had served to protect lower castes and Dalits from discrimination and violence, had been “rampantly misused.”","History of caste-based discrimination and violence against Dalits despite constitutional and legal protections, and impunity for those who commit crimes against Dalits.",">10,000","Members of the lower castes, Dalits.",1 week,"After the protests began, the government asked the Supreme Court to review the case. In October 2019, the Supreme Court reversed its previous ruling.",
India,Citizenship law protests,Dec-19,Free,"Passage of a bill, the Citizen Amendment Act, amending India’s citizenship law. It offers conditional amnesty and a path to citizenship for non-Muslim religious minorities from three neighboring countries (Afghanistan, Bangladesh, and Pakistan) who did not migrate to the country legally. The bill contains no such exemptions for Muslim migrants, fueling criticism that it discriminates against Muslims.","Concern over rising Hindu nationalism under Prime Minister Narendra Modi, marginalization of Muslims, and opposition to migration (among citizens in northeastern India­).",">100,000","Students, young people (protesting discrimination against Muslims), citizens in northeastern India (protesting migration).",Active,No policy/leadership change in response to the protests.,
India,24-hour strike,Jan-20,Free,Publication of government statistics predicting slowing economic growth.,Opposition to Modi’s economic policies (including privatization).,">10,000","Trade unions, students.",1 day,No policy/leadership change in response to the protests.,
India,Migrant worker protest,Apr-20,Free,Migrant workers’ demand to receive back wages and to be permitted to return home to local villages.,Extension of existing lockdown restrictions to combat coronavirus.,Thousands,Migrant workers.,1 day,No policy/leadership change in response to the protests.,
Indonesia,West Papua protests,Aug-19,Partly free,Racist remarks made by military officers and nationalist militia directed against Papuan citizens.,"Discrimination against and marginalization of Papuan citizens, tensions between Papuans and the central government, desires for Papuan independence, and the effects of extractive industries in West Papua.",">10,000",Papuan citizens.,1 month,No policy/leadership change in response to the protests.,
Indonesia,Criminal code protests,Sep-19,Partly free,"Consideration of a new criminal code that could violate the rights of women, religious minorities, and LGBT groups, and passage of a bill to weaken the country’s anticorruption commission.",Weakening of anticorruption body and growing skepticism of President Joko Widodo’s commitment to reforms.,">10,000",University students.,1 week,The vote on a new criminal code was delayed.,
Iran,Budget protests,Dec-17,Not free,"Concerns over a weak economy and the high prices of basic goods, as well as the publication of a government budget that would slash cash subsidies and increase fuel prices.","Slow economic growth, lack of political freedoms and openness, and corruption.",">10,000","Younger, working-class citizens, some of whom are from towns and rural cities.",2 months,No policy/leadership change in response to the protests.,
Iran,Fuel hike protests,Nov-19,Not free,Increase in gasoline prices due to the growing budget deficit.,Economic challenges (growing budget deficit and high inflation) and discontent toward political leaders.,"200,000",Low-income and working-class families.,1 month,No policy/leadership change in response to the protests.,
