Iran,Downed plane protests,Jan-20,Not free,"Admission by a military commander that Iran’s military had shot down a Ukraine International Airlines jet, after the government had denied doing so for days.",Lack of government transparency and accountability and popular discontent with political leadership.,">1,000",University students.,3 days,No policy/leadership change in response to the protests.,
Iraq,Iraq protests,Oct-19,Not free,"Demotion of a popular counterterrorism leader who was fighting government corruption, as well as the violent response to antigovernment protests in early October 2019.","Inadequate public services, government corruption, unemployment, discontent with the country’s sectarian political system, Iranian influence in Iraq, and government repression of protests.",">10,000","Young people (especially young men), university students.",Active,"Adel Abdul-Mahdi resigned as prime minister but remained as a caretaker until February 2020, when Mohammed Allawi was appointed prime minister. Allawi failed to assemble a government, however, and consequently never took office. He was replaced by Adnan al-Zurfi.",
Israel,Recommendations bill protests,Dec-17,Free,"Draft law that would end the existing practice of having police recommend to prosecutors whether to indict suspects, while also preventing police recommendations from being made public and penalizing leaks from investigations. Suspicions that the law's implications could affect an ongoing investigation into Prime Minister Benjamin Netanyahu.",Government corruption and lack of transparency.,"20,000",General public.,3 weeks,Netanyahu called for reforms to the draft bill to exclude him from its purview.,
Israel,Nation-state law protests,Aug-18,Free,Passage of a nation-state law that would affirm Israel’s Jewish character and potentially marginalize non-Jewish citizens.,Anti-Arab discrimination.,"30,000","Jews, Palestinians.",3 weeks,"No policy/leadership change in response to the protests. The High Court agreed to hear cases against the law, but hearings have been repeatedly postponed.",
Israel,Israel coronavirus protests,Mar-20,Free,"Prime Minister Benjamin Netanyahu’s expansion of authority during the coronavirus outbreak, such as using phone surveillance technology, shutting down the court system, adjourning parliament, and planning to annex parts of the West Bank.",Perceptions of Netanyahu’s actions as antidemocratic or authoritarian.,2000,General public.,Active,No policy/leadership change in response to the protests.,
Italy,Union-led economic protests,Feb-19,Free,Announced investment and pension reform that unions viewed as inadequate to combat economic stagnation and high unemployment.,"Economic stagnation, lack of employment opportunities, and government's failure to address challenges such as corruption, climate change, and sexism.",">100,000",Trade unions.,2 months,No policy/leadership change in response to the protests.,
Italy,Prison protest,Mar-20,Free,"Overcrowding in prisons during the coronavirus outbreak. Government decision to suspend or limit family visits to more than two dozen prisons for the next two weeks, due to coronavirus concerns.","Prison overcrowding, lack of government support for the prison system, and poor conditions in prisons.",Unknown,Prisoners.,1 day,No policy/leadership change in response to the protests.,
Japan,Police brutality protests,June-20,Free,"The death of George Floyd in the United States, sparking protests against local police brutality and racism in Japan, most recently manifesting in police violence against a Kurdish man.","Police brutality, systemic racism, and lack of government recognition of systemic racism.",">1,000",General public.,Active,No policy/leadership change in response to the protests.,
Jordan,Tax law protests,May-18,Partly free,Tax hikes and price increases for electricity and fuel.,"Government corruption, lack of political rights, and a stagnant economy.",">10,000","Youth movement, civil society groups, professional associations, labor unions.",1 week,"Then prime minister Hani Mulki stepped down, and his successor, Omar Razzaz, rescinded the proposed changes.",
Kazakhstan,Election protests,Jun-19,Not free,Recent presidential election results that were seen as undemocratic/illegitimate.,Undemocratic elections and lack of meaningful political choice and change.,">1,000",General public.,5 days,No policy/leadership change in response to the protests.,
Lebanon,WhatsApp tax protests,Oct-19,Partly free,"Introduction of taxes on tobacco, petrol, and WhatsApp voice calls.","High youth unemployment and a currency crisis, income inequality, poor service delivery, and political nepotism and corruption due to sectarianism.","1,000,000",Different religious sects.,Active,"Then prime minister Saad Hariri and his entire government resigned. Protests have continued despite the formation of a new government led by his successor, Hassan Diab, as demonstrators believe the new government does not represent a significant change.",
Lebanon,Prison protest,Mar-20,Partly free,Overcrowding in prisons during the coronavirus outbreak.,Overcrowding in Lebanese prisons.,Unknown,Prisoners.,1 day,No policy/leadership change in response to the protests.,
Liberia,Economic protests,Jun-19,Partly free,Protest organized by the opposition to highlight rising prices and allegations of corruption.,"Stagnant economy, high levels of poverty and inflation, and corruption.",">1,000","Opposition parties, civil society activists.",7 months (sporadic),The government called for a roundtable to discuss how to revive the economy.,
Madagascar,Electoral law protests,Apr-18,Partly free,"Passage of new electoral laws that opposition candidates saw as preventing them from running for elections, with additional unfavorable provisions on campaign financing and media access.",Obstacles to opposition candidates’ participation.,">1,000",Opposition candidates.,1 month,"In May 2018, the court ruled part of the electoral law to be unconstitutional, specifically provisions on the revision of electoral lists and the duration of campaigns. Demonstrations continued after this initial ruling, and weeks after the first decision, the court ordered the dissolution of the government and appointment of a new prime minister.",
Malawi,Election fraud protests,May-19,Partly free,"Suspicions that the May 2019 election, which President Peter Mutharika won by only 159,000 votes, was rigged.",Election fraud and bribery.,"100,000",Opposition party leaders and their supporters.,Active,"No policy/leadership change in response to the protests. The opposition challenged the election results in the court for the first time in Malawi’s history. Despite attempts by Mutharika’s supporters to bribe judges on the Constitutional Court, the court nullified the results of the presidential elections, citing irregularities. Electoral commissioners have refused to step down.",
Maldives,Maldives protests,Feb-18,Partly free,"Order by the Supreme Court for the government to release opposition leaders from prison, which the government disobeyed. Security forces later arrested two out of five Supreme Court justices, blocked off parliament, and arrested several opposition leaders.",Imprisonment of political opponents and attacks on judicial independence.,">1,000",General public.,1 month,No policy/leadership change in response to the protests.,
Mali,Ethnic violence protest,Apr-19,Partly free,Killing of 160 villagers in an interethnic conflict.,Failure of government to quell/respond to interethnic violence.,"12,500","Muslim religious leaders, representatives of the Fulani herding community, opposition parties, civil society groups.",1 day,Then prime minister Soumeylou Boubèye Maïga and his entire government stepped down.,
Mali,Movement of June 5,Jun-20,Partly free,Worsening of the security situation in Mali’s northern and central regions.,"Lack of political reform, economic stagnation, government corruption, and regime’s inability to address the worsening conflict.",Tens of thousands,General public.,Active,No policy or leadership change in response to the protests.,
Malta,“Mafia state” protests,Nov-19,Free,Developments in the investigation of the 2017 death of a journalist.,"Then prime minister Joseph Muscat’s influence over law enforcement and judicial systems, and corruption among political leaders.","4,000",Civil society.,2 months,Muscat resigned.,
Mexico,Femicide protests,Mar-20,Partly free,"Recent murder of a twenty-five-year-old woman and sevent-year-old girl. Overall increase in gender violence and femicide, and lack of an effective government response.","Violence against women, and lack of a government focus on addressing gender-based violence.",">10,000","Women, feminist organizations.",3 weeks,No policy or leadership change in response to the protests.,
Moldova,Corruption protests,Jun-18,Partly free,Supreme Court's decision to annul the results of the mayoral election in the capital.,Lack of judicial independence.,"20,000",Opposition parties and their supporters.,2 months,No policy/leadership change in response to the protests.,
Mongolia,Corruption protests,Dec-18,Free,Corruption allegations against the speaker of parliament and other political figures.,"Corruption allegations against political elites, falling foreign investment and currency values, and democratic backslide.","20,000",General public.,6 months,"The speaker of parliament, Enkhbold Miyegombo, was removed from office.",
Montenegro,Corruption protests,Mar-19,Partly free,Allegations of corruption against President Milo Đukanović.,Democratic backslide and corruption.,"10,000","Civic activists, students, academics, journalists.",2 months,No policy/leadership change in response to the protests.,
Montenegro,“Religion law” protests,Dec-19,Partly free,"Passage of a law that would mandate the creation of a register for all religious buildings and sites owned by the independent kingdom of Montenegro before 1918, when Montenegro became part of the Kingdom of Serbs, Croats and Slovenes, which was later renamed Yugoslavia. Any faith group that could not provide evidence that they owned the property could lose rights to the property.",Concerns among supporters of the Serbian Orthodox Church that the government is attempting to seize the church’s assets and distance Montenegro from Serbia.,"60,000","Serbian Orthodox Church clergy and their supporters, pro-Russian and pro-Serbian political movements.",4 months,No policy/leadership change in response to the protests.,
Morocco,Teacher protests,Feb-19,Partly free,"Anniversary of the Arab Spring uprising. Discontent over fixed-term contracts for teachers, limited opportunities for low-ranking teachers, and temporary government contracts that provide limited healthcare or pension benefits.",Inadequate compensation and benefits for teachers.,"15,000","Teachers, teachers’ unions.",2 months,"The Moroccan government and public unions made a deal to increase salaries for public sector employees and establish a new minimum wage for national education sector employees. However, contracted teachers did not receive benefits.",
Nepal,“Guthi bill” protests,Jun-19,Partly free,"Proposal of a bill that would affect a historical trust system (the guthi system) that helps maintain temples and other traditional public spaces, while helping organize public events. The bill would have established an authority governing all guthis and would have ended the current system of ownership by communities or families.",Concerns for Sanatan Hindu traditions.,"50,000","Trustees, cultural experts, activists, civil society, members of the Newar community.",10 days,The government withdrew the guthi bill.,
New Zealand,Racial equality protests,Jun-20,Free,"Death of George Floyd in the United States, sparking protests against local police brutality and racism in New Zealand.",Systemic racism and police violence against indigenous people.,">10,000",General public.,1 week,The police commissioner announced that the New Zealand Police would do away with its armed response teams.,
Nicaragua,Social security reform protests,Apr-18,Partly free,Proposal of reforms to the social security system.,Violent repression of initial protests and broader democratic backslide.,">100,000","University students, business sector, general public.",4 months,"President Daniel Ortega revoked the changes, but protests did not stop. Police violently repressed the protests.",
Pakistan,Islamabad sit-in protests,Oct-19,Partly free,Antigovernment march from Karachi to Islamabad to hold a sit-in on the capital’s main highway.,"Economic crisis, rising inflation, and suspicion that the 2018 election was rigged.","20,000","Conservative Islamist party, teachers and students from religious schools.",2 weeks,No policy/leadership change in response to the protests.,
Peru,Fujimori pardon protests,Dec-17,Free,"Then president Pedro Pablo Kuczynski’s pardon of former president Alberto Fujimori, who was convicted for corruption and human rights violations.","Controversy over Fujimori’s authoritarian legacy, and concerns that Kuczynski had pardoned him as part of a deal to survive an impeachment effort over Kuczynski’s connections to the Brazilian construction company Odebrecht.",60000,General public.,3 days,No policy/leadership change in response to the protests.,
Poland,Judicial reform protests,Jul-18,Free,Signing of a law that forced many Supreme Court justices into early retirement and created a judicial disciplinary chamber.,Erosion of judicial independence and democratic backslide.,">10,000",General public.,3 weeks,No policy/leadership change in response to the protests.,
Poland,“Muzzle law” protests,Dec-19,Free,Draft law that would permit government sanctions against judges who question the legitimacy of the ruling party’s judicial reforms and that would prohibit judges from engaging in any political activity.,Erosion of judicial independence.,"30,000","Polish judges and lawyers, judges from across Europe.",1 month,No policy/leadership change in response to the protests.,
Portugal,Police brutality protest,Jun-20,Free,"Death of George Floyd in the United States, sparking protests against local police brutality and racism in Portugal.","Police brutality, systemic racism, and lack of government recognition of systemic racism.",">10,000",General public.,1 day,No policy/leadership change in response to the protests.,
Romania,Corruption protests,Jan-17,Free,"Government attempts to decriminalize corruption offenses, limit judicial independence through reforms, and obstruct anticorruption investigations.","Government corruption, subversion of democratic processes, and erosion of judicial independence.","500,000","Key participants varied by protest, from urban young people to Romanian diaspora, magistrates.",2 years (sporadic),"In some (but not all) cases, the government reversed decrees in response to the protests.",
Russia,Corruption protest,Mar-17,Not free,"Publication of a video by opposition politician Alexei Navalny, alleging that then prime minister Dmitry Medvedev had accumulated luxury mansions, yachts, and vineyards.",Economic downturn and corruption.,"60,000","Opposition leaders, activists.",1 day,No policy/leadership change in response to the protests.,
Russia,Moscow election protests,Jul-19,Not free,Banning of some opposition politicians from running in Moscow city council elections.,Growing authoritarianism under President Vladimir Putin.,"50,000","Opposition groups with various political affiliations, young people.",1 month,No policy/leadership change in response to the protests.,
Russia,Constitutional changes protests,Feb-20,Not free,"Constitutional changes that could allow President Vladimir Putin to stay in power past 2024, as well as the five-year anniversary of the death of an opposition leader.","Opposition to constitutional changes, falling popularity of Putin","22,000",Political opposition.,Active,No policy or leadership change in response to the protests.,
Russia,Coronavirus restrictions protests,Apr-20,Not free,Economic implications of the shutdown and self-isolation measures established in response to the coronavirus pandemic.,"Concern over the economic effects of the shutdown, particularly in poorer areas that have lower infection rates.","2,000",General public.,1 day,No policy/leadership change in response to the protests.,
Serbia,“1 Out of 5 Million” protests,Dec-18,Free,"Violent attack on an opposition leader, and President Aleksandar Vučić’s mockery of the ensuing protests.","Corruption, nepotism, government incompetence, state control of media, and rising authoritarianism.","37,500",Opposition parties.,"1 year, 2 months",No policy/leadership change in response to the protests.,
Slovakia,“For a Decent Slovakia” protests,Mar-18,Free,Murder of a journalist who was at the time investigating connections between the Italian mafia and high-ranking Slovakian politicians.,Continued government corruption and popular distrust in the current government.,"65,000",Young people.,"1 year, 6 months",Then prime minister Robert Fico resigned and was succeeded by a deputy.,
South Africa,Anti-Zuma protest,Apr-17,Free,Ouster of popular African National Congress finance minister Pravin Gordhan.,"Economic challenges, inequality, corruption, political cronyism, and growing disapproval of then president Jacob Zuma.","30,000",General public.,1 day,No policy/leadership change in response to the protests.,
South Africa,Violence against women protests,Sep-19,Free,Spate of femicides.,Violence against women and lack of institutional protections for women.,4000,Gender rights activist organizations.,1 month,"In November 2019, President Cyril Ramphosa launched a “16 days of activism” campaign to raise awareness around the rights of women and girls. In his 2020 State of the Union, Ramphosa announced plans to help curb violence against women.",
South Korea,Candlelight demonstrations,Oct-16,Free,"Revelations that Choi Soon-sil, the confidante and old friend of then president Park Geun-hye, exercised undue influence. Choi allegedly urged businesses to donate to her own foundations in return for political favors, accessed classified government documents despite lacking the necessary authorization, and played a role in selecting presidential aides.","Improper influence of outside individuals, including friends of politicians as well as business elites and family-run conglomerates; increasing class divisions and inequality and lack of social mobility and economic opportunity, especially for younger citizens; and patriarchy and sexism in South Korea.",1.5 million,"Trade unions, students, feminist groups, families, representatives from parties on the political right and left.",5 months,Park was impeached.,
South Korea,Justice minister protests,Oct-19,Free,"Allegations of corruption against the then justice minister, Cho Kuk, who had pushed for prosecutorial reforms.",Government corruption and public distrust of prosecutors.,">100,000","Anti-Cho protesters: evangelical Christian activists, conservatives, older citizens; pro-Cho protestors: younger, urban, white-collar workers.",2 months,Then justice minister Cho resigned.,
Spain,Catalan independence protests,Oct-19,Free,Sentencing of Catalan separatist leaders to prison.,"Catalan independence, dissatisfaction with the government response to the independence movement, and belief that Catalonia should retain more of its own tax revenues.","600,000",Pro-independence groups and their supporters.,2 months,"No policy/leadership change in response to the protests. After winning support from Catalan separatist party, Prime Minister Pedro Sánchez promised to resolve the Catalan dispute through dialogue.",
Spain,Coronavirus protests,May-20,Free,"Protesters’ claims that the government misrepresented the extent of the health crisis, violated citizens’ rights by confining them to their homes and ruling by decree, and damaged the economy.","Economic effects of the lockdown, and concerns of government overreach.",Thousands,Supporters of the far-right Vox party.,1 day,No policy/leadership change in response to the protests.,
Sri Lanka,Constitutional crisis protests,Oct-18,Partly free,Then president Maithripala Sirisena’s dismissal of then prime minster Ranil Wickremesinghe and the suspension of parliament.,Fears of majoritarianism and return of minority repression.,"62,500",Supporters of the former prime minister.,2 days,Wickremasinghe was reappointed as prime minister for a time.,
Sudan,Sudanese revolution,Dec-18,Not free,Hike in bread prices during a period of high inflation.,"Discontent with the ruling party and political and economic elites, economic downturn, and the heavy-handed response to initial protests.",">100,000","General public, trade union of professionals, women.",1 year,"Then president Omar Al-Bashir was forced out of office, and his regime was dismantled. A transition government composed of both military and civilian leaders is currently in place, with elections scheduled for 2021.",
Taiwan,Pension reform protest,Jan-17,Free,Pension reform plans.,"Discontent with the government, slowing economic growth, and concerns over the pension system's solvency with a rapidly aging population.","12,000","Public employees such as military personnel, teachers, police, civil servants.",1 day,No policy/leadership change in response to the protests.,
Taiwan,Taiwan “Yellow Vest” protests,Dec-18,Free,High taxes and the unfair handling of tax disputes.,An unfair and confusing taxation system.,"20,000","Activist groups, general public.",2 weeks,No policy/leadership change in response to the protests.,
Togo,Term limit protests,Sep-17,Partly free,Demands for presidential term limits on President Faure Gnassingbé.,"Concerns over dynastic politics, poor living conditions, and high youth unemployment.","800,000","Coalition of opposition parties, protestors from varying age groups, social classes, ethnicities.",7 months,No policy/leadership change in response to the protests.,
Turkey,“March for Justice” protest,Jul-17,Not free,End of twenty-five-day “March for Justice” against President Recep Tayyip Erdoğan.,Government crackdown against critics and civil servants and the expansion of executive power.,">100,000",Turkey’s largest pposition party.,1 day,No policy/leadership change in response to the protests.,
Turkey,Economic protest,Dec-18,Not free,"Rising cost of living, high inflation, and “Yellow Vest” movement in France.","Rising inflation, slowing economic growth, and high cost of living.",">1,000",Public service workers’ unions.,1 day,No policy/leadership change in response to the protests.,
Ukraine,Peace plan protests,Oct-19,Partly free,President Volodymyr Zelensky’s decision to grant special status to a separatist region in eastern Ukraine as part of a larger deal with Moscow.,Opposition to policy changes regarding Russia.,"20,000","War veterans, moderate critics of Zelensky, nationalist and far-right activists.",1 week,No policy/leadership change in response to the protests.,
United Kingdom,People’s Vote protests,Jun-18,Free,"Discontent with the state of Brexit negotiations between the British government and the EU, and popular demands for a second Brexit referendum.",Concern over Brexit and its implications.,1 million,"People’s Vote campaign, pro-EU groups, general public.","1 year, 4 months (sporadic)",No policy/leadership change in response to the protests.,
United Kingdom,Black Lives Matter protests,Jun-20,Free,"Death of George Floyd in the United States, sparking protests against local police brutality and racism in the UK.",Systemic racism in the UK and the country’s imperial legacy.,Tens of thousands,General public.,Active,The establishment of a government commission to examine racial inequality.,
United States,Immigration ban protests,Jan-17,Free,President Donald Trump’s executive order preventing travelers from seven Muslim-majority nations from entering the country.,Concerns over discrimination against Muslims.,">10,000",General public.,3 days,No policy/leadership change in response to the protests.,
United States,“Keep Families Together” protest,Jun-18,Free,"President Donald Trump’s “zero tolerance” immigration policy, which separated children from their parents at the U.S. border with Mexico.",Government immigration policy.,">10,000",General public.,1 day,No policy/leadership change in response to the protests.,
United States,“Lights for Liberty” protest,Jul-19,Free,Conditions in migrant detention camps.,Opposition to President Donald Trump’s migration policies.,">100,000","General public (including protests in all fifty states, with a significant number occurring in regions that had voted for Trump in 2016).",1 day,No policy/leadership change in response to the protests.,
United States,“Telegramgate” protests,Jul-19,Free,Leak of Puerto Rico government officials’ racist and homophobic messages.,"Continued economic challenges, government mismanagement, and corruption.","500,000",Puerto Ricans.,1 week,Then Puerto Rican governor Ricardo Rosselló resigned.,
United States,Coronavirus lockdown protests,Apr-20,Free,"Extended business closures due to stay-at-home orders, as well as restrictions on movement.",Economic impacts of statewide shutdowns.,">10,000","Conservative organizers, grassroots groups.",Active,"Some states, such as Florida and Texas, have begun to partially reopen or plan on doing so soon.",
United States,Prison protest,Apr-20,Free,Rising number of coronavirus cases in Arizona immigrant detention facilities.,Risk of the coronavirus spreading within prisons or other detention facilities.,>700,Immigration activists.,1 day,No policy/leadership change in response to the protests.,
